<?xml version="1.0" encoding="UTF-8"?>
<!DOCTYPE statements SYSTEM "subtransaction.dtd">
<statements>

	<savepoint name="prog1"/>
	<savepoint name="prog2"/>

	<rollbackTo name="prog1"/>
	<rollbackTo name="prog1"/>
	<releaseSavepoint name="prog1"/>

	<subtransBegin/>
	<rollbackTo name="prog2">
		<delete insertOfStatement="4"/>
		<delete insertOfStatement="5"/>
	</rollbackTo>

</statements>