<?xml version="1.0" encoding="UTF-8"?>
<!DOCTYPE statements SYSTEM "subtransaction.dtd">
<statements>

	<subtransBegin/>

		<savepoint name="u1_prog1"/>

			<subtransBegin/>
			<subtransEnd/>

			<subtransBegin/>
			<subtransRollback/>

			<subtransBegin/>
			<subtransRollback/>

		<releaseSavepoint name="u1_prog1"/>

		<savepoint name="u2_prog1"/>

			<subtransBegin/>
			<subtransBegin/>
			<subtransBegin/>

			<subtransEnd/>
			<subtransRollback/>
			<subtransEnd/>

		<releaseSavepoint name="u2_prog1"/>

		<savepoint name="u3_prog1"/>

			<subtransBegin/>
			<subtransEnd/>

			<subtransBegin/>
			<subtransBegin/>

			<subtransRollback/>
			<subtransEnd/>

		<rollbackTo name="u3_prog1"/>


	<subtransEnd/>

	<savepoint name="prog2"/>

		<subtransBegin>
			<delete insertOfStatement="0"/>
			<delete insertOfStatement="3"/>
			<delete insertOfStatement="6"/>
			<delete insertOfStatement="9"/>
		</subtransBegin>

		<subtransEnd>
			<delete insertOfStatement="12"/>
			<delete insertOfStatement="15"/>
			<delete insertOfStatement="18"/>
			<delete insertOfStatement="21"/>
		</subtransEnd>

		<subtransBegin>
			<delete insertOfStatement="1"/>
			<delete insertOfStatement="4"/>
			<delete insertOfStatement="7"/>
			<delete insertOfStatement="10"/>
		</subtransBegin>

		<subtransRollback>
			<delete insertOfStatement="13"/>
			<delete insertOfStatement="16"/>
			<delete insertOfStatement="19"/>
			<delete insertOfStatement="22"/>
		</subtransRollback>

		<subtransBegin>
			<delete insertOfStatement="2"/>
			<delete insertOfStatement="5"/>
			<delete insertOfStatement="8"/>
			<delete insertOfStatement="11"/>
		</subtransBegin>

		<subtransRollback>
			<delete insertOfStatement="14"/>
			<delete insertOfStatement="17"/>
			<delete insertOfStatement="20"/>
			<delete insertOfStatement="23"/>
		</subtransRollback>

	<rollbackTo name="prog2"/>


	<subtransBegin/>

		<savepoint name="u1_prog3"/>
		<savepoint name="u2_prog3"/>
		<savepoint name="u3_prog3"/>

		<releaseSavepoint name="u3_prog3"/>
		<rollbackTo name="u1_prog3"/>
		<releaseSavepoint name="u1_prog3"/>
		<rollbackTo name="u2_prog3"/>



		<savepoint name="u4_prog3">
			<delete insertOfStatement="35"/>
		</savepoint>

		<savepoint name="u5_prog3">
			<delete insertOfStatement="36"/>
		</savepoint>

		<savepoint name="u6_prog3">
			<delete insertOfStatement="37"/>
		</savepoint>

		<releaseSavepoint name="u4_prog3">
			<delete insertOfStatement="38"/>
		</releaseSavepoint>

		<rollbackTo name="u5_prog3">
			<delete insertOfStatement="39"/>
		</rollbackTo>

		<releaseSavepoint name="u6_prog3">
			<delete insertOfStatement="40"/>
		</releaseSavepoint>


	<subtransRollback/>

</statements>