<?xml version="1.0" encoding="UTF-8"?>
<!DOCTYPE statements SYSTEM "subtransaction.dtd">
<statements>
	<savepoint name="start0"/>
	<savepoint name="start1"/>
	<savepoint name="start2"/>
	<savepoint name="start3"/>
	<savepoint name="start4"/>
	<savepoint name="start5"/>
	<savepoint name="start6"/>
	<savepoint name="start7"/>
	<savepoint name="start8"/>
	<savepoint name="start9"/>

	<savepoint name="start10"/>
	<savepoint name="start11"/>
	<savepoint name="start12"/>
	<savepoint name="start13"/>
	<savepoint name="start14"/>
	<savepoint name="start15"/>
	<savepoint name="start16"/>
	<savepoint name="start17"/>
	<savepoint name="start18"/>
	<savepoint name="start19"/>

	<savepoint name="start20"/>
	<savepoint name="start21"/>
	<savepoint name="start22"/>
	<savepoint name="start23"/>
	<savepoint name="start24"/>
	<savepoint name="start25"/>
	<savepoint name="start26"/>
	<savepoint name="start27"/>
	<savepoint name="start28"/>
	<savepoint name="start29"/>

	<savepoint name="start30"/>
	<savepoint name="start31"/>
	<savepoint name="start32"/>
	<savepoint name="start33"/>
	<savepoint name="start34"/>
	<savepoint name="start35"/>
	<savepoint name="start36"/>
	<savepoint name="start37"/>
	<savepoint name="start38"/>
	<savepoint name="start39"/>

	<savepoint name="start40"/>
	<savepoint name="start41"/>
	<savepoint name="start42"/>
	<savepoint name="start43"/>
	<savepoint name="start44"/>
	<savepoint name="start45"/>
	<savepoint name="start46"/>
	<savepoint name="start47"/>
	<savepoint name="start48"/>
	<savepoint name="start49"/>

	<savepoint name="start50"/>
	<savepoint name="start51"/>
	<savepoint name="start52"/>
	<savepoint name="start53"/>
	<savepoint name="start54"/>
	<savepoint name="start55"/>
	<savepoint name="start56"/>
	<savepoint name="start57"/>
	<savepoint name="start58"/>
	<savepoint name="start59"/>



	<rollbackTo name="start59"/>
	<rollbackTo name="start58"/>
	<rollbackTo name="start57"/>
	<rollbackTo name="start56"/>
	<rollbackTo name="start55"/>
	<rollbackTo name="start54"/>
	<rollbackTo name="start53"/>
	<rollbackTo name="start52"/>
	<rollbackTo name="start51"/>
	<rollbackTo name="start50"/>

	<rollbackTo name="start49"/>
	<rollbackTo name="start48"/>
	<rollbackTo name="start47"/>
	<rollbackTo name="start46"/>
	<rollbackTo name="start45"/>
	<rollbackTo name="start44"/>
	<rollbackTo name="start43"/>
	<rollbackTo name="start42"/>
	<rollbackTo name="start41"/>
	<rollbackTo name="start40"/>

	<rollbackTo name="start39"/>
	<rollbackTo name="start38"/>
	<rollbackTo name="start37"/>
	<rollbackTo name="start36"/>
	<rollbackTo name="start35"/>
	<rollbackTo name="start34"/>
	<rollbackTo name="start33"/>
	<rollbackTo name="start32"/>
	<rollbackTo name="start31"/>
	<rollbackTo name="start30"/>

	<rollbackTo name="start29"/>
	<rollbackTo name="start28"/>
	<rollbackTo name="start27"/>
	<rollbackTo name="start26"/>
	<rollbackTo name="start25"/>
	<rollbackTo name="start24"/>
	<rollbackTo name="start23"/>
	<rollbackTo name="start22"/>
	<rollbackTo name="start21"/>
	<rollbackTo name="start20"/>

	<rollbackTo name="start19"/>
	<rollbackTo name="start18"/>
	<rollbackTo name="start17"/>
	<rollbackTo name="start16"/>
	<rollbackTo name="start15"/>
	<rollbackTo name="start14"/>
	<rollbackTo name="start13"/>
	<rollbackTo name="start12"/>
	<rollbackTo name="start11"/>
	<rollbackTo name="start10"/>

	<rollbackTo name="start9"/>
	<rollbackTo name="start8"/>
	<rollbackTo name="start7"/>
	<rollbackTo name="start6"/>
	<rollbackTo name="start5"/>
	<rollbackTo name="start4"/>
	<rollbackTo name="start3"/>
	<rollbackTo name="start2"/>
	<rollbackTo name="start1"/>
	<rollbackTo name="start0"/>

</statements>