<?xml version="1.0" encoding="UTF-8"?>
<!DOCTYPE statements SYSTEM "subtransaction.dtd">
<statements>
	<savepoint name="start0"/>
	<savepoint name="start1"/>
	<savepoint name="start2"/>
	<savepoint name="start3"/>
	<savepoint name="start4"/>
	<savepoint name="start5"/>
	<savepoint name="start6"/>
	<savepoint name="start7"/>
	<savepoint name="start8"/>
	<savepoint name="start9"/>

	<savepoint name="start10"/>
	<savepoint name="start11"/>
	<savepoint name="start12"/>
	<savepoint name="start13"/>
	<savepoint name="start14"/>
	<savepoint name="start15"/>
	<savepoint name="start16"/>
	<savepoint name="start17"/>
	<savepoint name="start18"/>
	<savepoint name="start19"/>

	<savepoint name="start20"/>
	<savepoint name="start21"/>
	<savepoint name="start22"/>
	<savepoint name="start23"/>
	<savepoint name="start24"/>
	<savepoint name="start25"/>
	<savepoint name="start26"/>
	<savepoint name="start27"/>
	<savepoint name="start28"/>
	<savepoint name="start29"/>

	<savepoint name="start30"/>
	<savepoint name="start31"/>
	<savepoint name="start32"/>
	<savepoint name="start33"/>
	<savepoint name="start34"/>
	<savepoint name="start35"/>
	<savepoint name="start36"/>
	<savepoint name="start37"/>
	<savepoint name="start38"/>
	<savepoint name="start39"/>

	<savepoint name="start40"/>
	<savepoint name="start41"/>
	<savepoint name="start42"/>
	<savepoint name="start43"/>
	<savepoint name="start44"/>
	<savepoint name="start45"/>
	<savepoint name="start46"/>
	<savepoint name="start47"/>
	<savepoint name="start48"/>
	<savepoint name="start49"/>

	<savepoint name="start50"/>
	<savepoint name="start51"/>
	<savepoint name="start52"/>
	<savepoint name="start53"/>
	<savepoint name="start54"/>
	<savepoint name="start55"/>
	<savepoint name="start56"/>
	<savepoint name="start57"/>
	<savepoint name="start58"/>
	<savepoint name="start59"/>


	<releaseSavepoint name="start59"/>
	<releaseSavepoint name="start58"/>
	<releaseSavepoint name="start57"/>
	<releaseSavepoint name="start56"/>
	<releaseSavepoint name="start55"/>
	<releaseSavepoint name="start54"/>
	<releaseSavepoint name="start53"/>
	<releaseSavepoint name="start52"/>
	<releaseSavepoint name="start51"/>
	<releaseSavepoint name="start50"/>

	<releaseSavepoint name="start49"/>
	<releaseSavepoint name="start48"/>
	<releaseSavepoint name="start47"/>
	<releaseSavepoint name="start46"/>
	<releaseSavepoint name="start45"/>
	<releaseSavepoint name="start44"/>
	<releaseSavepoint name="start43"/>
	<releaseSavepoint name="start42"/>
	<releaseSavepoint name="start41"/>
	<releaseSavepoint name="start40"/>

	<releaseSavepoint name="start39"/>
	<releaseSavepoint name="start38"/>
	<releaseSavepoint name="start37"/>
	<releaseSavepoint name="start36"/>
	<releaseSavepoint name="start35"/>
	<releaseSavepoint name="start34"/>
	<releaseSavepoint name="start33"/>
	<releaseSavepoint name="start32"/>
	<releaseSavepoint name="start31"/>
	<releaseSavepoint name="start30"/>

	<releaseSavepoint name="start29"/>
	<releaseSavepoint name="start28"/>
	<releaseSavepoint name="start27"/>
	<releaseSavepoint name="start26"/>
	<releaseSavepoint name="start25"/>
	<releaseSavepoint name="start24"/>
	<releaseSavepoint name="start23"/>
	<releaseSavepoint name="start22"/>
	<releaseSavepoint name="start21"/>
	<releaseSavepoint name="start20"/>

	<releaseSavepoint name="start19"/>
	<releaseSavepoint name="start18"/>
	<releaseSavepoint name="start17"/>
	<releaseSavepoint name="start16"/>
	<releaseSavepoint name="start15"/>
	<releaseSavepoint name="start14"/>
	<releaseSavepoint name="start13"/>
	<releaseSavepoint name="start12"/>
	<releaseSavepoint name="start11"/>
	<releaseSavepoint name="start10"/>

	<releaseSavepoint name="start9"/>
	<releaseSavepoint name="start8"/>
	<releaseSavepoint name="start7"/>
	<releaseSavepoint name="start6"/>
	<releaseSavepoint name="start5"/>
	<releaseSavepoint name="start4"/>
	<releaseSavepoint name="start3"/>
	<releaseSavepoint name="start2"/>
	<releaseSavepoint name="start1"/>
	<releaseSavepoint name="start0"/>

</statements>