<?xml version="1.0" encoding="UTF-8"?>
<!DOCTYPE statements SYSTEM "subtransaction.dtd">
<statements>
	<subtransBegin/>
	<subtransEnd/>

	<subtransBegin/>
	<subtransBegin>
		<delete insertOfStatement="0"/>
		<delete insertOfStatement="2"/>
	</subtransBegin>
	<subtransEnd/>
	<subtransRollback/>

</statements>
