<?xml version="1.0" encoding="UTF-8"?>
<!DOCTYPE statements SYSTEM "subtransaction.dtd">
<statements>
	<subtransBegin/>

		<savepoint name="prog1"/>
		<rollbackTo name="prog1"/>
		<rollbackTo name="prog1"/>
		<rollbackTo name="prog1"/>

		<subtransBegin>
			<delete insertOfStatement="1"/>
			<delete insertOfStatement="2"/>
			<delete insertOfStatement="3"/>
			<delete insertOfStatement="4"/>
		</subtransBegin>
		<subtransRollback/>

	<subtransEnd/>

</statements>